commit	val_bpb	memory_gb	status	description
51442fa	2.296100	0.0	discard	experiment 1901: UNEMBEDDING_LR 0.004->0.003 (+0.014 bpb)
51442fa	2.283900	0.0	discard	experiment 1902: grad clip 0.06->0.07 (noise, avg 2.2839)
0973bef	2.345600	0.0	discard	experiment 1903: cautious mask on gradient step (+0.063 bpb)
0973bef	2.285300	0.0	discard	experiment 1904: Adam beta1 0.01->0.005 (noise)
0973bef	2.000000	0.0	discard	experiment 1905: lm_head bias (assertion failure, param count mismatch)
0973bef	2.284800	0.0	discard	experiment 1906: warmdown exponent 0.7->0.75 (noise)
0973bef	2.290000	0.0	discard	experiment 1907: remove NorMuon (+0.008 bpb)
0973bef	2.284400	0.0	discard	experiment 1908: lm_head WD 0.005 (noise)
0973bef	2.301100	0.0	discard	experiment 1909: sigmoid-constrained x0/resid mixing (+0.019 bpb)
0973bef	2.280800	0.0	discard	experiment 1910: Muon beta2 0.99->0.95 (noise, 0.0002 better but step count confound)
0af0c47	2.280800	0.0	discard	experiment 1911: remove resid_lambdas multiply (noise, 0.0004 better)
0af0c47	2.000000	0.0	discard	experiment 1912: hybrid warmdown power-law+linear (killed by OOM, exit 137)
6e84703	2.279600	0.0	discard	experiment 1913: FINAL_LR_FRAC 0.05->0.08 (noise at 24 steps)
6e84703	2.278900	-0.001	keep	experiment 1914: FINAL_LR_FRAC 0.05->0.10 (-0.001 bpb, 4 runs avg 2.2789 vs baseline 2.2799)
6e84703	2.281400	0.0	discard	experiment 1915: FINAL_LR_FRAC 0.10->0.15 (inconsistent, step count confound)
e48d76a	2.2820	0.0	discard	experiment 1916: STABLE_RATIO 0.30->0.25 (noise, no improvement)
e48d76a	2.2820	0.0	discard	experiment 1917: warmdown exponent 0.7->0.8 (noise, avg 2.2820)
e48d76a	2.2823	0.0	discard	experiment 1918: warmdown exponent 0.7->0.5 (noise, 2.2823)
e48d76a	2.2837	0.0	discard	experiment 1919: linear warmdown (worse, 2.2837)
e48d76a	2.2852	0.0	discard	experiment 1920: MATRIX_LR 0.12->0.14 (worse, 2.2852)
e48d76a	2.2829	0.0	discard	experiment 1921: attn_dropout 0.12->0.15 (noise, 2.2829)
e48d76a	2.2834	0.0	discard	experiment 1922: constant momentum 0.95 (worse, 2.2834)
e48d76a	2.2821	0.0	discard	experiment 1923: grad clip 0.06->0.05 (noise, 2.2821)
e48d76a	2.2898	0.0	discard	experiment 1924: remove grad clip (worse, 2.2898)
e48d76a	2.2835	0.0	discard	experiment 1925: EMBEDDING_LR 1.2->1.4 (worse, 2.2835)
e48d76a	2.2816	0.0	discard	experiment 1926: WEIGHT_DECAY 0.01->0.008 (noise, 2.2816)
e48d76a	2.2806	0.0	discard	experiment 1927: UNEMBEDDING_LR 0.004->0.0045 (noise, avg 2.2806 vs baseline 2.2805)
e48d76a	2.2854	0.0	discard	experiment 1928: UNEMBEDDING_LR 0.004->0.0035 (worse, 2.2854)
