commit	val_bpb	memory_gb	status	description
0670ad3	2.280207	0.0	discard	experiment 1366: Adam beta2 0.99->0.95 (noise)
0670ad3	2.279685	0.0	discard	experiment 1367: embedding dropout 0.08->0.05 (noise)
0670ad3	2.279457	0.0	discard	experiment 1368: SCALAR_LR 0.45->0.55 (noise)
0670ad3	2.279363	0.0	discard	experiment 1369: softcap 20->25 (noise)
0670ad3	2.279649	0.0	discard	experiment 1370: resid_lambdas LR 0.01->0.005 (noise)
0670ad3	2.279924	0.0	discard	experiment 1371: attn_dropout 0.12->0.10 (noise)
0670ad3	2.279547	0.0	discard	experiment 1372: constant momentum 0.98 (noise)
0670ad3	2.284195	0.0	discard	experiment 1373: DEPTH 6->5 ASPECT_RATIO 48->64 (+0.004 bpb)
0670ad3	2.283843	0.0	discard	experiment 1374: WARMUP_RATIO 0.0->0.03 (+0.004 bpb)
0670ad3	2.279560	0.0	discard	experiment 1375: mlp_dropout 0.20->0.15 (noise)
0670ad3	2.280425	0.0	discard	experiment 1376: Muon ns_steps 1->2 (noise)
01d2c28	2.285581	0.0	discard	experiment 1377: quadratic decay schedule (+0.006 bpb)
01d2c28	2.284434	0.0	discard	experiment 1378: sqrt decay schedule (+0.004 bpb)
01d2c28	2.281368	0.0	discard	experiment 1379: cosine decay schedule (+0.001 bpb)
01d2c28	2.283958	0.0	discard	experiment 1380: x0_lambdas init 0.0->0.1 (+0.004 bpb)
01d2c28	2.279565	0.0	discard	experiment 1381: STABLE_RATIO 0.35->0.40 (noise)
01d2c28	2.279708	0.0	discard	experiment 1382: EMBEDDING_LR 1.0->0.8 (noise)
01d2c28	2.289171	0.0	discard	experiment 1383: UNEMBEDDING_LR 0.004->0.003 (+0.009 bpb)
01d2c28	2.280514	0.0	discard	experiment 1384: gradient clipping 0.05->0.03 (noise)
01d2c28	2.281563	0.0	discard	experiment 1385: remove cautious WD mask (+0.002 bpb)
01d2c28	2.999000	0.0	discard	experiment 1386: DEVICE_BATCH_SIZE 16->32 (FAIL, OOM)
01d2c28	2.286488	0.0	discard	experiment 1387: embedding init std 1.0->0.8 (+0.007 bpb)
01d2c28	2.281829	0.0	discard	experiment 1388: decaying WD schedule (+0.002 bpb)
01d2c28	2.282144	0.0	discard	experiment 1389: MATRIX_LR 0.12->0.10 (+0.002 bpb)
01d2c28	2.281001	0.0	discard	experiment 1390: polar norm 1.02->1.00 (+0.001 bpb)
01d2c28	2.281828	0.0	discard	experiment 1391: Muon beta2 0.99->0.95 (+0.002 bpb)
01d2c28	2.281473	0.0	discard	experiment 1392: logit dropout 0.05 (+0.001 bpb)
01d2c28	2.280851	0.0	discard	experiment 1393: NorMuon clamp 1e-10->1e-8 (noise)
01d2c28	2.284025	0.0	discard	experiment 1394: dropout before norm (+0.004 bpb)
384acfe	2.281099	0.0	discard	experiment 1395: MATRIX_LR 0.14 + WD 0.02 (+0.001 bpb)
384acfe	2.278076	0.0	keep	experiment 1396: STABLE_RATIO 0.25 + FINAL_LR_FRAC 0.05 (-0.002 bpb)
0a00b94	2.282197	0.0	discard	experiment 1397: STABLE_RATIO 0.25->0.20 (+0.003 bpb)
0a00b94	2.283548	0.0	discard	experiment 1398: FINAL_LR_FRAC 0.05->0.08 (+0.004 bpb)
0a00b94	2.281777	0.0	discard	experiment 1399: FINAL_LR_FRAC 0.05->0.03 (+0.002 bpb)
0a00b94	2.283036	0.0	discard	experiment 1400: MATRIX_LR 0.12->0.13 (+0.003 bpb)
0a00b94	2.280734	0.0	discard	experiment 1401: EMBEDDING_LR 1.0->1.5 (noise)
0a00b94	2.283299	0.0	discard	experiment 1402: embedding WD 0.001 (+0.003 bpb)
0a00b94	2.282868	0.0	discard	experiment 1403: WEIGHT_DECAY 0.01->0.005 (+0.003 bpb)
0a00b94	2.280755	0.0	discard	experiment 1404: STABLE_RATIO 0.25->0.30 (noise)
0a00b94	2.285531	0.0	discard	experiment 1405: x0 LR * 0.5 (+0.006 bpb)
0a00b94	2.283621	0.0	discard	experiment 1406: x0 LR * 2.0 (+0.004 bpb)
0a00b94	2.281702	0.0	discard	experiment 1407: softcap 20->15 (+0.002 bpb)
0a00b94	2.278917	0.0	discard	experiment 1408: MLP hidden 1.5x->2x (noise, fewer steps)
0a00b94	2.280408	0.0	discard	experiment 1409: remove softcap entirely (noise)
0a00b94	2.280780	0.0	discard	experiment 1410: attn_dropout 0.15 mlp_dropout 0.25 (noise)
0a00b94	2.314829	0.0	discard	experiment 1411: resid_lambdas init 1.0->0.95 (+0.035 bpb)
0a00b94	2.295698	0.0	discard	experiment 1412: inverse decay schedule (+0.016 bpb)
341efec	2.285439	0.0	discard	experiment 1413: lm_head init std 0.001->0.005 (+0.006 bpb)
341efec	2.284243	0.0	discard	experiment 1414: transformer init std 3->5 (+0.004 bpb)
341efec	2.279867	0.0	discard	experiment 1415: reduce rotary seq len (noise)
341efec	2.280977	0.0	discard	experiment 1416: momentum start 0.85->0.80 (noise)
341efec	2.303279	0.0	discard	experiment 1417: label smoothing 0.01 (+0.023 bpb)
341efec	2.296493	0.0	discard	experiment 1418: UNEMBEDDING_LR 0.004->0.006 (+0.017 bpb)
341efec	2.282625	0.0	discard	experiment 1419: x0 WD 0.001 (+0.003 bpb)
44291d8	2.280462	0.0	discard	experiment 1420: WINDOW_PATTERN L->SL (noise)
44291d8	2.284353	0.0	discard	experiment 1421: MATRIX_LR 0.14 + EMBEDDING_LR 0.8 (+0.004 bpb)
44291d8	2.283533	0.0	discard	experiment 1422: Adam eps 1e-10->1e-12 (+0.004 bpb)
44291d8	2.283366	0.0	discard	experiment 1423: norm x0 skip (+0.003 bpb)
44291d8	2.283305	0.0	discard	experiment 1424: MATRIX_LR 0.12->0.11 (+0.003 bpb)
44291d8	0.000000	0.0	discard	experiment 1425: step guard 10->5 (OOM killed)
44291d8	2.284158	0.0	discard	experiment 1426: SCALAR_LR 0.45->0.30 (noise)
44291d8	2.281617	0.0	discard	experiment 1427: SCALAR_LR 0.45->0.60 (noise)
44291d8	2.282923	0.0	discard	experiment 1428: WEIGHT_DECAY 0.01->0.02 (noise)
44291d8	2.283376	0.0	discard	experiment 1429: ADAM_BETAS beta2 0.99->0.95 (noise)
44291d8	2.288139	0.0	discard	experiment 1430: x0_lambdas init 0.0->0.1 (+0.005 bpb)
44291d8	2.280193	0.0	keep	experiment 1431: EMBEDDING_LR 1.0->1.2 (-0.003 bpb, verified 3 runs)
c150b80	2.284158	0.0	discard	experiment 1432: MATRIX_LR 0.12->0.13 (+0.002 bpb)
c150b80	2.282232	0.0	discard	experiment 1433: EMBEDDING_LR 1.2->1.4 (+0.002 bpb)
c150b80	2.281153	0.0	discard	experiment 1434: grad clip 0.05->0.10 (noise)
c150b80	2.280052	0.0	discard	experiment 1435: softcap 20->15 (noise)
c150b80	2.280882	0.0	discard	experiment 1436: softcap 20->30 (noise)
c150b80	2.288177	0.0	discard	experiment 1437: TOTAL_BATCH_SIZE 2^16->2^15 (+0.008 bpb)
c150b80	2.283156	0.0	discard	experiment 1438: Muon momentum max 0.98->0.95 (+0.003 bpb)
c150b80	2.280655	0.0	discard	experiment 1439: STABLE_RATIO 0.25->0.20 (noise)
c150b80	2.279906	0.0	discard	experiment 1440: FINAL_LR_FRAC 0.05->0.03 (marginal, noise)
c150b80	2.282859	0.0	discard	experiment 1441: cosine warmdown schedule (+0.003 bpb)
c150b80	2.290755	0.0	discard	experiment 1442: UNEMBEDDING_LR 0.004->0.003 (+0.011 bpb)
c150b80	2.287318	0.0	discard	experiment 1443: UNEMBEDDING_LR 0.004->0.005 (+0.007 bpb)
c150b80	2.280995	0.0	discard	experiment 1444: Adam beta1 0.01->0.05 (noise)
c150b80	2.282552	0.0	discard	experiment 1445: remove softcap (+0.003 bpb)
c150b80	2.283304	0.0	discard	experiment 1446: embedding dropout 0.08->0.04 (+0.003 bpb)
c150b80	2.280867	0.0	discard	experiment 1447: STABLE 0.25->0.20 + FINAL_LR 0.05->0.03 (noise)
c150b80	2.280683	0.0	discard	experiment 1448: init std factor 3->5 (noise)
e927afa	2.284125	0.0	discard	experiment 1449: QK-norm before RoPE (+0.004 bpb)
e927afa	2.280244	0.0	discard	experiment 1450: Muon ns_steps 1->2 (noise)
e927afa	2.280608	0.0	discard	experiment 1451: Muon beta2 0.99->0.999 (noise)
e927afa	2.280378	0.0	discard	experiment 1452: EMBEDDING_LR 1.2->1.3 (noise)
e927afa	2.279252	0.0	keep	experiment 1453: Muon momentum start 0.85->0.90 (-0.001 bpb, verified 3 runs)
1c86aad	2.280343	0.0	discard	experiment 1454: Muon momentum start 0.90->0.92 (noise)
1c86aad	2.280798	0.0	discard	experiment 1455: Muon momentum warmup 2->1 steps (noise)
1c86aad	2.280807	0.0	discard	experiment 1456: Muon momentum warmup 2->3 steps (noise)
1c86aad	2.281427	0.0	discard	experiment 1457: RoPE base 5000->3000 (+0.002 bpb)
1c86aad	2.279569	0.0	discard	experiment 1458: RoPE base 5000->7000 (noise)
1c86aad	2.279319	0.0	discard	experiment 1459: embedding init std 1.0->0.5 (noise)
1c86aad	2.281864	0.0	discard	experiment 1460: remove cautious WD mask (+0.002 bpb)
1c86aad	2.280649	0.0	discard	experiment 1461: polar express norm 1.02->1.05 (noise)
1c86aad	2.279356	0.0	discard	experiment 1462: FINAL_LR_FRAC 0.05->0.03 (noise)
1c86aad	2.279361	0.0	discard	experiment 1463: WEIGHT_DECAY 0.01->0.005 (noise)
1c86aad	2.280356	0.0	discard	experiment 1464: lm_head init std 0.001->0.002 (noise)
1c86aad	2.284572	0.0	discard	experiment 1465: c_proj small init instead of zero (+0.005 bpb)
1c86aad	2.281352	0.0	discard	experiment 1466: MATRIX_LR 0.12->0.10 (+0.002 bpb)
e4ea247	2.280343	0.0	discard	experiment 1454: Muon momentum start 0.90->0.92 (noise)
e4ea247	2.280798	0.0	discard	experiment 1455: Muon momentum warmup 2->1 steps (noise)
e4ea247	2.280807	0.0	discard	experiment 1456: Muon momentum warmup 2->3 steps (noise)
e4ea247	2.281457	0.0	discard	experiment 1467: SiLU->GELU in MLP (noise)
e4ea247	0.000000	0.0	discard	experiment 1468: attn weight dropout (too slow, aborted)
e4ea247	2.286524	0.0	discard	experiment 1469: HEAD_DIM 64->48 (+0.007 bpb)
e4ea247	2.279408	0.0	discard	experiment 1470: ASPECT_RATIO 48->56 (noise, fewer steps)
e4ea247	2.286584	0.0	discard	experiment 1471: ASPECT_RATIO 48->42 (+0.007 bpb)
e4ea247	2.280097	0.0	discard	experiment 1472: DEPTH 5 + wider (noise)
e4ea247	2.290705	0.0	discard	experiment 1473: DEPTH 7 (+0.011 bpb, too few steps)
e4ea247	2.280208	0.0	discard	experiment 1475: SCALAR_LR 0.45->0.60 (noise)
e4ea247	2.287151	0.0	discard	experiment 1476: WARMUP_RATIO 0.0->0.05 (+0.008 bpb)
e4ea247	2.286049	0.0	discard	experiment 1477: MLP hidden ratio 3/2->4/3 (+0.007 bpb)
e4ea247	2.277164	0.0	keep	experiment 1478: MLP hidden 2x (-0.002 bpb, verified 3 runs)
3a4142f	2.278815	0.0	discard	experiment 1479: MLP hidden 5/2x (+0.006 bpb)
3a4142f	2.280397	0.0	discard	experiment 1480: MATRIX_LR 0.12->0.14 (+0.003 bpb)
3a4142f	2.278975	0.0	discard	experiment 1481: mlp_dropout 0.20->0.15 (noise)
3a4142f	2.279591	0.0	discard	experiment 1482: mlp_dropout 0.20->0.25 (noise)
3a4142f	2.280114	0.0	discard	experiment 1483: STABLE_RATIO 0.25->0.15 (+0.002 bpb)
3a4142f	2.278679	0.0	discard	experiment 1485: STABLE 0.30 + FINAL_LR 0.03 (noise)
3a4142f	2.279044	0.0	discard	experiment 1486: attn_dropout 0.12->0.08 (noise)
3a4142f	2.277851	0.0	discard	experiment 1487: grad clip 0.05->0.03 (noise)
3a4142f	2.278816	0.0	discard	experiment 1489: MLP hidden 7/4x (noise vs 2x)
3a4142f	2.280594	0.0	discard	experiment 1490: embedding dropout 0.08->0.12 (+0.003 bpb)
3a4142f	2.278509	0.0	discard	experiment 1491: reduce all dropouts (noise)
3a4142f	2.285983	0.0	discard	experiment 1492: remove post-embedding norm (+0.008 bpb)
3a4142f	2.282543	0.0	discard	experiment 1493: SiLU->Mish (+0.005 bpb)
3a4142f	2.287243	0.0	discard	experiment 1494: quadratic warmdown (+0.010 bpb)
3a4142f	2.277254	0.0	keep	experiment 1495: sqrt warmdown schedule (-0.002 bpb, verified 4 runs)
12c4289	2.276634	0.0	keep	experiment 1496: warmdown exponent 0.5->0.7 (-0.001 bpb, verified 3 runs)
97e9551	2.277078	0.0	discard	experiment 1497: warmdown exponent 0.7->0.8 (noise)
97e9551	2.279605	0.0	discard	experiment 1498: warmdown exponent 0.7->0.6 (+0.003 bpb)
97e9551	2.277339	0.0	discard	experiment 1499: FINAL_LR_FRAC 0.05->0.02 (noise)
97e9551	2.276989	0.0	discard	experiment 1500: Muon momentum max 0.98->0.99 (noise)
97e9551	2.313771	0.0	discard	experiment 1501: TOTAL_BATCH_SIZE 2^16->2^17 (+0.037 bpb)
97e9551	2.277597	0.0	discard	experiment 1502: x0_lambdas beta1 0.5->0.9 (noise)
97e9551	2.276566	0.0	discard	experiment 1503: resid_lambdas LR x2 (noise)
97e9551	2.276248	0.0	keep	experiment 1504: embedding weight decay 0.01 (-0.001 bpb, verified 3 runs)
d0e0796	2.275967	0.0	keep	experiment 1505: embedding WD 0.01->0.02 (-0.0003 bpb, verified 3 runs)
e1333f7	2.276158	0.0	discard	experiment 1506: embedding WD 0.02->0.03 (noise)
e1333f7	2.276135	0.0	discard	experiment 1507: lm_head WD 0.01 (noise)
e1333f7	2.277720	0.0	discard	experiment 1508: Muon WD 0.01->0.015 (+0.002 bpb)
e1333f7	2.275995	0.0	discard	experiment 1509: RoPE base 5000->4000 (noise)
e1333f7	2.275580	0.0	keep	experiment 1510: STABLE_RATIO 0.25->0.30 (-0.0003 bpb, verified 3 runs)
c623021	2.275959	0.0	discard	experiment 1511: STABLE_RATIO 0.30->0.35 (noise)
c623021	2.275958	0.0	discard	experiment 1512: EMBEDDING_LR 1.2->1.5 (noise)
c623021	2.275479	0.0	keep	experiment 1513: polar express norm 1.02->1.00 (-0.0002 bpb, verified 3 runs)
bb495e4	2.275359	0.0	discard	experiment 1514: WEIGHT_DECAY 0.01->0.008 (noise)
bb495e4	2.275484	0.0	discard	experiment 1515: FINAL_LR_FRAC 0.05->0.10 (noise)
bb495e4	2.279529	0.0	discard	experiment 1516: MLP hidden 9/5x (+0.004 bpb)
7f2282d	2.280483	0.0	discard	experiment 1517: MATRIX_LR 0.12->0.15 (+0.005 bpb)
7f2282d	2.275352	0.0	keep	experiment 1518: dropout 0.15->0.18 (-0.0002 bpb, verified 3 runs avg 2.275352)
8ae7e98	2.275390	0.0	discard	experiment 1519: SCALAR_LR 0.45->0.50 (noise)
8ae7e98	2.276970	0.0	discard	experiment 1520: SCALAR_LR 0.45->0.40 (+0.002 bpb)
8ae7e98	2.275321	0.0	discard	experiment 1521: ADAM_BETAS beta1 0.01->0.005 (noise, verified 2 runs)
8ae7e98	2.279429	0.0	discard	experiment 1522: FINAL_LR_FRAC 0.05->0.08 (+0.004 bpb)
8ae7e98	2.277505	0.0	discard	experiment 1523: FINAL_LR_FRAC 0.05->0.03 (+0.002 bpb)
8ae7e98	2.275892	0.0	discard	experiment 1524: embedding dropout 0.08->0.10 (noise)
8ae7e98	2.279364	0.0	discard	experiment 1525: embedding dropout 0.08->0.06 (+0.004 bpb)
8ae7e98	2.276279	0.0	discard	experiment 1526: warmdown exponent 0.7->0.8 (+0.001 bpb)
8ae7e98	2.275516	0.0	discard	experiment 1527: warmdown exponent 0.7->0.6 (noise)
8ae7e98	2.276323	0.0	discard	experiment 1528: attn_dropout 0.12->0.15 (+0.001 bpb)
8ae7e98	2.276071	0.0	discard	experiment 1529: attn_dropout 0.12->0.10 (+0.001 bpb)
8ae7e98	2.276487	0.0	discard	experiment 1530: mlp_dropout 0.20->0.22 (+0.001 bpb)
8ae7e98	2.282353	0.0	discard	experiment 1531: x0_lambdas beta1 0.5->0.3 (+0.007 bpb)
8ae7e98	2.276517	0.0	discard	experiment 1532: x0_lambdas beta1 0.5->0.7 (+0.001 bpb)
8ae7e98	2.275564	0.0	discard	experiment 1533: grad clip 0.05->0.04 (noise)
8ae7e98	2.275563	0.0	discard	experiment 1534: grad clip 0.05->0.07 (noise, verified 2 runs)
8ae7e98	2.275354	0.0	discard	experiment 1535: resid_lambdas LR 0.01->0.02 scaling (OOM kill)
c74d667	2.303687	0.0	discard	experiment 1536: label smoothing 0.0->0.01 (+0.028 bpb)
c74d667	2.276124	0.0	discard	experiment 1537: softcap 20->25 (+0.001 bpb)
c74d667	2.275019	0.0	keep	experiment 1538: softcap 20->18 (-0.0003 bpb, verified 3 runs avg 2.275019)
18df0d8	2.276866	0.0	discard	experiment 1539: softcap 18->16 (+0.002 bpb)
18df0d8	2.283238	0.0	discard	experiment 1540: UNEMBEDDING_LR 0.004->0.005 (+0.008 bpb)
18df0d8	2.283349	0.0	discard	experiment 1541: UNEMBEDDING_LR 0.004->0.003 (+0.008 bpb)
18df0d8	2.279503	0.0	discard	experiment 1542: lm_head init std 0.001->0.0001 (+0.004 bpb)
18df0d8	2.280130	0.0	discard	experiment 1543: lm_head init std 0.001->0.01 (+0.005 bpb)
18df0d8	2.278399	0.0	discard	experiment 1544: embedding init std 1.0->0.5 (+0.003 bpb)
18df0d8	2.281499	0.0	discard	experiment 1545: embedding init std 1.0->2.0 (+0.006 bpb)
18df0d8	2.278169	0.0	discard	experiment 1546: EMBEDDING_LR 1.2->1.4 (+0.003 bpb)
18df0d8	2.277067	0.0	discard	experiment 1547: MATRIX_LR 0.12->0.10 (+0.002 bpb)
18df0d8	2.280860	0.0	discard	experiment 1548: Muon beta2 0.99->0.999 (+0.006 bpb)
18df0d8	2.279122	0.0	discard	experiment 1549: Muon beta2 0.99->0.95 (+0.004 bpb)
18df0d8	2.279102	0.0	discard	experiment 1550: lm_head WD 0->0.01 (+0.004 bpb)
18df0d8	2.276186	0.0	discard	experiment 1551: Muon ns_steps 1->2 (+0.001 bpb)
18df0d8	2.275035	0.0	discard	experiment 1552: WEIGHT_DECAY 0.01->0.015 (noise, verified 2 runs)
18df0d8	2.278345	0.0	discard	experiment 1553: regular WD instead of cautious WD (+0.003 bpb)
18df0d8	2.277916	0.0	discard	experiment 1554: Muon momentum end 0.98->0.97 (+0.003 bpb)
18df0d8	2.280881	0.0	discard	experiment 1555: Muon momentum end 0.98->0.99 (+0.006 bpb)
18df0d8	2.283151	0.0	discard	experiment 1556: embedding WD 0.02->0.03 (+0.008 bpb)
18df0d8	2.284713	0.0	discard	experiment 1557: init std (2/3n)^0.5->(2/5n)^0.5 (+0.010 bpb)
18df0d8	2.279774	0.0	discard	experiment 1558: init std (2/3n)^0.5->(2/2n)^0.5 (+0.005 bpb)
18df0d8	2.275702	0.0	discard	experiment 1559: TOTAL_BATCH_SIZE 2^16->2^15 (+0.001 bpb)
18df0d8	2.308299	0.0	discard	experiment 1560: TOTAL_BATCH_SIZE 2^16->2^17 (+0.033 bpb)
18df0d8	2.277313	0.0	discard	experiment 1561: ADAM_BETAS beta2 0.99->0.995 (noise, verified 2 runs)
18df0d8	2.280663	0.0	discard	experiment 1562: GELU gate instead of SiLU (+0.006 bpb)
18df0d8	2.287212	0.0	discard	experiment 1563: norm before c_proj in attention (+0.012 bpb)
18df0d8	2.278040	0.0	discard	experiment 1564: STABLE_RATIO 0.30->0.20 (+0.003 bpb)
18df0d8	2.278016	0.0	discard	experiment 1565: dropout 0.18->0.20 (+0.003 bpb)
18df0d8	2.278576	0.0	discard	experiment 1566: EMBEDDING_LR 1.2->1.1 (+0.004 bpb)
18df0d8	2.276594	0.0	discard	experiment 1567: MLP output scale 0.9x (+0.002 bpb)
0361688	2.276046	0.0	discard	experiment 1568: x0_lambdas init 0.0->0.1 (+0.001 bpb)
0361688	2.275314	0.0	discard	experiment 1569: resid_lambdas init 1.0->0.95 (noise)
0361688	2.275141	0.0	discard	experiment 1570: softcap 18->19 (noise)
0361688	2.285568	0.0	discard	experiment 1571: QK-norm RMSNorm on Q and K (+0.011 bpb)
0361688	2.277369	0.0	discard	experiment 1572: RoPE base 5000->7000 (+0.002 bpb)
0361688	2.277327	0.0	discard	experiment 1573: RoPE base 5000->3000 (+0.002 bpb)
0361688	2.276546	0.0	discard	experiment 1574: MLP hidden 2x->5/2x (+0.002 bpb)
0361688	2.280126	0.0	discard	experiment 1575: WARMUP_RATIO 0.0->0.05 (+0.005 bpb)
0361688	2.278021	0.0	discard	experiment 1576: x0_lambdas beta2 0.99->0.95 (+0.003 bpb)
0361688	2.279932	0.0	discard	experiment 1577: polar express epsilon 1e-6->1e-8 (+0.005 bpb)
0361688	2.281283	0.0	discard	experiment 1578: Muon momentum warmup 2->3 steps (+0.006 bpb)
0361688	2.278844	0.0	discard	experiment 1579: Muon momentum warmup 2->1 step (+0.004 bpb)
0361688	2.278882	0.0	discard	experiment 1580: MATRIX_LR 0.12->0.13 (+0.004 bpb)
0361688	2.276372	0.0	discard	experiment 1581: MATRIX_LR 0.12->0.11 (+0.001 bpb)
0361688	2.279880	0.0	discard	experiment 1582: cosine warmdown (+0.005 bpb)
0361688	2.279468	0.0	discard	experiment 1583: HEAD_DIM 64->32 (+0.004 bpb)
0361688	2.279404	0.0	discard	experiment 1584: decaying WD (+0.004 bpb)
3118c40	2.294248	0.0	discard	experiment 1585: z-loss 1e-4 (+0.019 bpb)
3118c40	2.280790	0.0	discard	experiment 1586: EMBEDDING_LR 1.2->1.3 (+0.006 bpb)
3118c40	2.280792	0.0	discard	experiment 1587: embedding WD 0.02->0.015 (+0.006 bpb)
3118c40	2.289704	0.0	discard	experiment 1588: remove softcap entirely (+0.015 bpb)
3118c40	2.278721	0.0	discard	experiment 1589: WEIGHT_DECAY 0.01->0.005 (+0.004 bpb)
3118c40	2.278679	0.0	discard	experiment 1590: WEIGHT_DECAY 0.01->0.02 (+0.004 bpb)
3118c40	2.280312	0.0	discard	experiment 1591: MLP hidden 2x->7/4x (+0.005 bpb)
3118c40	2.283892	0.0	discard	experiment 1592: Adam epsilon 1e-10->1e-8 (+0.009 bpb)
3118c40	2.284269	0.0	discard	experiment 1593: DEPTH 7 ASPECT 40 (+0.009 bpb)
3118c40	2.280250	0.0	discard	experiment 1594: DEPTH 5 ASPECT 56 (+0.005 bpb)
3118c40	2.278983	0.0	discard	experiment 1595: dropout 0.18->0.16 (+0.004 bpb)
3118c40	2.278400	0.0	discard	experiment 1596: ASPECT_RATIO 54 n_embd=384 (+0.003 bpb)
49085e7	2.284559	0.0	discard	experiment 1597: hard clamp ±18 instead of tanh softcap (+0.010 bpb)
49085e7	2.281123	0.0	discard	experiment 1598: attention scale 1/d^0.6 (+0.006 bpb)
49085e7	2.278891	0.0	discard	experiment 1599: mlp_dropout 0.20->0.18 (+0.004 bpb)
49085e7	2.278842	0.0	discard	experiment 1600: mlp_dropout 0.20->0.25 (+0.004 bpb)
49085e7	2.279544	0.0	discard	experiment 1601: attn_dropout 0.12->0.14 (+0.005 bpb)
49085e7	2.279412	0.0	discard	experiment 1602: grad clip 0.05->0.10 (+0.004 bpb)
49085e7	2.282022	0.0	discard	experiment 1603: grad clip 0.05->1.0 (+0.007 bpb)
49085e7	2.280613	0.0	discard	experiment 1604: grad clip 0.05->0.03 (+0.006 bpb)
49085e7	2.312555	0.0	discard	experiment 1605: polynomial softcap x/(1+|x|/18) (+0.038 bpb)
49085e7	2.284417	0.0	discard	experiment 1606: Muon momentum start 0.90->0.92 (+0.009 bpb)
aaa4406	2.283697	0.0	discard	experiment 1607: c_proj init small random instead of zeros (+0.009 bpb)
aaa4406	999.0	0.0	discard	experiment 1608: x0 shortcut after block instead of before (OOM kill)
aaa4406	2.280000	0.0	discard	experiment 1609: ADAM_BETAS beta2 0.99->0.98 (+0.005 bpb)
aaa4406	2.293000	0.0	discard	experiment 1610: post-norm instead of pre-norm (+0.018 bpb)
aaa4406	2.282000	0.0	discard	experiment 1611: SCALAR_LR 0.45->0.48 (+0.007 bpb)
aaa4406	2.281000	0.0	discard	experiment 1612: SCALAR_LR 0.45->0.42 (+0.006 bpb)
aaa4406	2.279000	0.0	discard	experiment 1613: softcap 18->17 (+0.004 bpb)
aaa4406	999.0	0.0	discard	experiment 1614: MQA n_kv_head=1 (hung/incomplete)
aaa4406	999.0	0.0	discard	experiment 1615: QK bias=True (IndexError)
6c0c73c	2.282870	0.0	discard	experiment 1616: partial RoPE (half head dims) (+0.008 bpb)
6c0c73c	2.281133	0.0	discard	experiment 1617: layer-wise LR decay 0.7-1.0 (+0.006 bpb)
6c0c73c	999.0	0.0	discard	experiment 1618: stochastic depth (TypeError, None grads)
6c0c73c	2.276376	0.0	discard	experiment 1619: embedding dropout 0.08->0.12 (+0.001 bpb)
6c0c73c	2.276527	0.0	discard	experiment 1620: L2 QK norm before RoPE (+0.002 bpb)
6c0c73c	2.278377	0.0	discard	experiment 1621: block output scaling 1/sqrt(n_layer) (+0.003 bpb)
6c0c73c	2.276583	0.0	discard	experiment 1622: shared Q/K projection (+0.002 bpb)
6c0c73c	2.280608	0.0	discard	experiment 1623: c_v init std 2x (+0.006 bpb)
6c0c73c	2.278479	0.0	discard	experiment 1624: x0_lambdas init -0.1 (+0.003 bpb)
6c0c73c	2.276913	0.0	discard	experiment 1625: attn_dropout 0.10, mlp_dropout 0.22 (+0.002 bpb)
6c0c73c	2.275179	0.0	discard	experiment 1626: learnable attn/mlp per-layer scales (noise)
6c0c73c	2.275912	0.0	discard	experiment 1628: ADAM beta1 0.01->0.03 (noise, high variance)
6c0c73c	2.275479	0.0	discard	experiment 1629: MLP c_proj init std=0.0001 (noise)
6c0c73c	2.275261	0.0	discard	experiment 1630: softcap 18->17.5 (noise)
6c0c73c	2.280191	0.0	discard	experiment 1631: softcap 18->18.5 (+0.005 bpb)
6c0c73c	2.284372	0.0	discard	experiment 1632: norm x0 residual (+0.009 bpb)
