commit	val_bpb	memory_gb	status	description
6c0c73c	2.279496	0.0	discard	experiment 1633: dropout before norm (+0.005 bpb)
6c0c73c	2.278567	0.0	discard	experiment 1634: parallel attention+MLP (+0.004 bpb)
6c0c73c	2.277213	0.0	discard	experiment 1635: EMBEDDING_LR 1.2->1.15 (+0.002 bpb)
6c0c73c	2.275791	0.0	discard	experiment 1636: attention scale 1/d^0.25 (noise)
13b70dc	2.278487	0.0	discard	experiment 1637: disable NorMuon variance reduction (+0.003 bpb)
13b70dc	2.275539	0.0	discard	experiment 1638: MATRIX_LR 0.12->0.115 (noise)
13b70dc	2.277610	0.0	discard	experiment 1639: Muon momentum end 0.98->0.975 (+0.003 bpb)
13b70dc	2.276979	0.0	discard	experiment 1640: decaying WD during warmdown (+0.002 bpb)
13b70dc	2.275253	0.0	discard	experiment 1641: x0_lambdas beta2 0.99->0.999 (noise)
13b70dc	2.278349	0.0	discard	experiment 1642: DEVICE_BATCH_SIZE 16->8 (+0.003 bpb)
13b70dc	2.280956	0.0	discard	experiment 1643: resid_lambdas LR 0.01->0.005 (+0.006 bpb)
13b70dc	2.280138	0.0	discard	experiment 1644: Muon momentum start 0.90->0.85 (+0.005 bpb)
13b70dc	2.281667	0.0	discard	experiment 1645: layernorm instead of rmsnorm (+0.007 bpb)
13b70dc	2.275360	0.0	discard	experiment 1646: freeze resid_lambdas at 1.0 (noise, avg same as baseline)
13b70dc	2.282603	0.0	discard	experiment 1647: separate gate/up MLP init (+0.008 bpb)
84f520e	2.274893	0.0	keep	experiment 1648: grad clip 0.05->0.06 (-0.0001 bpb, verified 4 runs avg 2.27490)
84f520e	2.274863	0.0	discard	experiment 1649: grad clip 0.06->0.08 (noise, same as 0.06)
84f520e	2.275205	0.0	discard	experiment 1650: embedding WD 0.02->0.03 (noise, avg same)
84f520e	2.274831	0.0	discard	experiment 1651: Adam eps 1e-10->1e-12 (noise)
84f520e	2.283673	0.0	discard	experiment 1652: softcap in bf16 before float (+0.009 bpb)
84f520e	2.274962	0.0	discard	experiment 1653: warmdown exponent 0.7->0.65 (noise)
84f520e	2.277243	0.0	discard	experiment 1654: STABLE_RATIO 0.30->0.35 (+0.002 bpb)
84f520e	2.277514	0.0	discard	experiment 1655: lm_head WD 0->0.005 (noise, unstable)
84f520e	2.284616	0.0	discard	experiment 1656: MLP dropout on up branch only (+0.010 bpb)
84f520e	2.279321	0.0	discard	experiment 1657: embedding dropout 0.08->0.06 (+0.004 bpb)
84f520e	2.277358	0.0	discard	experiment 1658: embedding dropout 0.08->0.10 (+0.003 bpb)
84f520e	2.280701	0.0	discard	experiment 1659: SiLU^2 gate (+0.006 bpb)
84f520e	2.275214	0.0	discard	experiment 1660: SCALAR_LR 0.45->0.50 (noise)
84f520e	2.281365	0.0	discard	experiment 1661: no x0 on first layer (+0.006 bpb)
3c4e859	2.280100	0.0	discard	experiment 1662: Muon warmup 2->3 steps (+0.005 bpb)
3c4e859	2.279800	0.0	discard	experiment 1663: WARMUP_RATIO 0.0->0.02 (+0.005 bpb)
3c4e859	2.277700	0.0	discard	experiment 1664: FINAL_LR_FRAC 0.05->0.07 (+0.003 bpb)
3c4e859	2.274900	0.0	discard	experiment 1665: FINAL_LR_FRAC 0.05->0.04 (noise)
3c4e859	2.276400	0.0	discard	experiment 1666: RoPE base 5000->6000 (+0.001 bpb)
3c4e859	2.275200	0.0	discard	experiment 1667: RoPE base 5000->4000 (noise)
3c4e859	2.275100	0.0	discard	experiment 1668: WEIGHT_DECAY 0.01->0.012 (noise)
3c4e859	2.275783	0.0	discard	experiment 1669: WEIGHT_DECAY 0.01->0.008 (+0.001 bpb)
313849a	2.280696	0.0	discard	experiment 1670: interleaved RoPE dimensions (+0.006 bpb)
313849a	2.276921	0.0	discard	experiment 1671: Muon ns_steps 1->2 (+0.002 bpb)
313849a	2.279086	0.0	discard	experiment 1672: Adam eps 1e-10->1e-8 (+0.004 bpb)
313849a	2.274755	0.0	discard	experiment 1673: Muon beta2 0.99->0.95 (noise, not verified)
4fc83d9	2.276442	0.0	discard	experiment 1674: Muon target momentum 0.98->0.95 (+0.002 bpb)
4fc83d9	2.275202	0.0	discard	experiment 1675: Adam beta1 0.01->0.02 (noise)
4fc83d9	2.275684	0.0	discard	experiment 1676: Adam beta1 0.01->0.005 (noise)
4fc83d9	2.275245	0.0	discard	experiment 1677: init std (2/5n)^0.5 (noise)
4fc83d9	2.275660	0.0	discard	experiment 1678: embedding init std 1.0->0.5 (noise)
4fc83d9	2.280190	0.0	discard	experiment 1679: lm_head init std 0.001->0.01 (+0.005 bpb)
4fc83d9	2.275917	0.0	discard	experiment 1680: x0_lambdas init 0.0->0.1 (noise)
4fc83d9	2.288317	0.0	discard	experiment 1681: UNEMBEDDING_LR 0.004->0.006 (+0.013 bpb)
4fc83d9	2.284705	0.0	discard	experiment 1682: UNEMBEDDING_LR 0.004->0.003 (+0.010 bpb)
4fc83d9	2.275917	0.0	discard	experiment 1683: resid_lambdas init 1.0->0.9 (noise)
4fc83d9	2.278700	0.0	discard	experiment 1684: x0 LR scale *0.5 (+0.004 bpb)
4fc83d9	2.285909	0.0	discard	experiment 1685: x0 beta1 0.5->0.3 (+0.011 bpb)
4fc83d9	2.290051	0.0	discard	experiment 1686: TOTAL_BATCH_SIZE 2^16->2^15 (+0.015 bpb)
4fc83d9	2.314980	0.0	discard	experiment 1687: TOTAL_BATCH_SIZE 2^16->2^17 (+0.040 bpb)
4fc83d9	2.390790	0.0	discard	experiment 1688: label smoothing 0.05 (+0.116 bpb)
4fc83d9	2.275274	0.0	discard	experiment 1689: NorMuon clamp 1e-10->1e-6 (noise)
4fc83d9	2.274950	0.0	discard	experiment 1690: remove cautious weight decay (noise)
07be9bd	2.275440	0.0	discard	experiment 1691: mlp_dropout 0.20->0.15 (noise, verified avg 2.2754)
07be9bd	2.275319	0.0	discard	experiment 1692: attn_dropout 0.12->0.10 (noise)
07be9bd	2.276664	0.0	discard	experiment 1693: resid_lambdas LR *0.01->*0.1 (+0.002 bpb)
07be9bd	2.279996	0.0	discard	experiment 1694: MATRIX_LR 0.12->0.10 (+0.005 bpb)
07be9bd	2.277362	0.0	discard	experiment 1695: MATRIX_LR 0.12->0.14 (+0.003 bpb)
07be9bd	2.274986	0.0	discard	experiment 1696: embedding dropout 0.08->0.05 (noise)
07be9bd	2.275244	0.0	discard	experiment 1697: warmdown exponent 0.7->0.8 (noise)
07be9bd	2.276142	0.0	discard	experiment 1698: softcap 18->17 (+0.001 bpb)
07be9bd	2.279970	0.0	discard	experiment 1699: remove softcap (+0.005 bpb)
07be9bd	2.287875	0.0	discard	experiment 1700: extra norm after attention (+0.013 bpb)
07be9bd	2.281250	0.0	discard	experiment 1701: MLP hidden 2x->2.5x (+0.006 bpb)
07be9bd	2.296369	0.0	discard	experiment 1702: remove embedding norm (+0.022 bpb)
cad9a2c	2.277309	0.0	discard	experiment 1703: remove embedding dropout (+0.002 bpb)
cad9a2c	2.283789	0.0	discard	experiment 1704: no polar express pre-norm (+0.009 bpb)
cad9a2c	2.276902	0.0	discard	experiment 1705: grad clip 0.06->0.08 (+0.002 bpb)
cad9a2c	2.281888	0.0	discard	experiment 1706: dropout after final norm instead of embedding (+0.007 bpb)
cad9a2c	2.281168	0.0	discard	experiment 1707: GeLU gate instead of SiLU (+0.006 bpb)
cad9a2c	2.278782	0.0	discard	experiment 1709: small non-zero c_proj init (+0.004 bpb)
cad9a2c	2.278061	0.0	discard	experiment 1710: cosine warmdown (+0.003 bpb)
cad9a2c	2.276835	0.0	discard	experiment 1711: EMBEDDING_LR 1.2->1.4 (+0.002 bpb)
96d2408	2.275389	0.0	discard	experiment 1712: combine emb dropout 0.05 + no cautious WD (noise)
96d2408	2.275802	0.0	discard	experiment 1713: momentum decay during warmdown (noise)
96d2408	2.275453	0.0	discard	experiment 1714: weight decay warmup (noise)
96d2408	2.275228	0.0	discard	experiment 1715: embedding WD 0.02->0.03 (noise)
96d2408	2.280080	0.0	discard	experiment 1716: lm_head WD 0->0.01 (+0.005 bpb)
96d2408	2.279969	0.0	discard	experiment 1717: Adam beta2 0.99->0.95 (+0.005 bpb)
96d2408	2.280553	0.0	discard	experiment 1718: SCALAR_LR 0.45->0.35 (+0.006 bpb)
96d2408	2.280566	0.0	discard	experiment 1719: SCALAR_LR 0.45->0.55 (+0.006 bpb)
e14ff92	2.279972	0.0	discard	experiment 1720: swapped SwiGLU gate*silu(up) (+0.005 bpb)
e14ff92	2.275015	0.0	discard	experiment 1723: resid_lambdas LR *0.001 (noise)
e14ff92	2.279473	0.0	discard	experiment 1722: STABLE_RATIO 0.30->0.35 (+0.005 bpb)
e14ff92	2.275190	0.0	discard	experiment 1725: LayerNorm for final norm (noise)
e14ff92	2.278372	0.0	discard	experiment 1726: 10% cooldown at final LR (+0.004 bpb)
e9da890	2.276085	0.0	discard	experiment 1727: softcap 18->19 (+0.001 bpb)
e9da890	2.281494	0.0	discard	experiment 1728: MATRIX_LR 0.12->0.13 (+0.007 bpb)
e9da890	2.279635	0.0	discard	experiment 1729: MATRIX_LR 0.12->0.11 (+0.005 bpb)
e9da890	2.289005	0.0	discard	experiment 1730: HEAD_DIM 64->32 (+0.014 bpb)
e9da890	2.285743	0.0	discard	experiment 1732: ASPECT_RATIO 48->64 (+0.011 bpb)
e9da890	2.276652	0.0	discard	experiment 1733: two-stage warmdown (+0.002 bpb)
e9da890	2.274975	0.0	discard	experiment 1734: EMBEDDING_LR 1.2->1.1 (noise)
e9da890	2.275411	0.0	discard	experiment 1735: EMBEDDING_LR 1.2->1.3 (noise)
937c5dd	2.279370	0.0	discard	experiment 1736: separate Adam LR decay ^1.5 (+0.005 bpb)
937c5dd	2.275575	0.0	discard	experiment 1737: grad clip 0.06->0.07 (noise)
937c5dd	2.276269	0.0	discard	experiment 1738: UNEMBEDDING_LR 0.004->0.0045 (+0.001 bpb)
cc7705c	2.284600	0.0	discard	experiment 1739: MLP dropout before c_proj (+0.010 bpb)
cc7705c	2.280726	0.0	discard	experiment 1740: tanh-GELU gate (+0.006 bpb)
cc7705c	2.275997	0.0	discard	experiment 1741: FINAL_LR_FRAC 0.05->0.03 (noise)
cc7705c	2.275401	0.0	discard	experiment 1742: WEIGHT_DECAY 0.01->0.015 (noise)
cc7705c	2.280078	0.0	discard	experiment 1743: partial RoPE 3/4 dims (+0.005 bpb)
cc7705c	2.282817	0.0	discard	experiment 1744: DEPTH 7 AR 40 (+0.008 bpb)
cc7705c	2.286830	0.0	discard	experiment 1745: DEPTH 5 (+0.012 bpb)
074700c	2.276000	0.0	discard	experiment 1746: STABLE_RATIO 0.30->0.20 (noise)
074700c	2.275100	0.0	discard	experiment 1747: softcap 18->18.5 (noise)
074700c	2.295800	0.0	discard	experiment 1748: torch.compile on CPU (+0.021 bpb)
074700c	2.279800	0.0	discard	experiment 1749: Muon momentum start 0.90->0.85 (+0.005 bpb)
06f8509	2.275300	0.0	discard	experiment 1750: K init std * 0.707 (noise)
06f8509	2.275700	0.0	discard	experiment 1751: Muon beta2 0.99->0.995 (noise)
06f8509	2.275400	0.0	discard	experiment 1752: Q init std * 1.414 (noise)
06f8509	2.275200	0.0	discard	experiment 1753: V init std * 0.5 (noise)
06f8509	2.275700	0.0	discard	experiment 1754: Adam beta2 0.99->0.95 (noise)
06f8509	2.275300	0.0	discard	experiment 1755: Adam beta1 0.01->0.05 (noise)
06f8509	2.277100	0.0	discard	experiment 1756: ReGLU gate (+0.002 bpb)
06f8509	2.285400	0.0	discard	experiment 1757: squared ReLU gate (+0.011 bpb)
06f8509	2.292700	0.0	discard	experiment 1758: post-norm on residual (+0.018 bpb)
06f8509	2.276900	0.0	discard	experiment 1759: softcap 18->16 (+0.002 bpb)
06f8509	2.277400	0.0	discard	experiment 1760: embed dropout 0.08->0.04 (+0.003 bpb)
06f8509	2.276300	0.0	discard	experiment 1761: embed dropout 0.08->0.12 (noise)
06f8509	2.279400	0.0	discard	experiment 1762: final x0 skip 0.1 (+0.005 bpb)
06f8509	2.278200	0.0	discard	experiment 1763: MLP c_fc init std * 2 (+0.003 bpb)
06f8509	2.277700	0.0	discard	experiment 1764: warmdown exponent 0.7->0.6 (noise, run2=2.280)
06f8509	2.276000	0.0	discard	experiment 1765: GELU gate (noise)
06f8509	2.279200	0.0	discard	experiment 1766: MATRIX_LR 0.12->0.11 (+0.004 bpb)
06f8509	2.276900	0.0	discard	experiment 1767: MATRIX_LR 0.12->0.13 (+0.002 bpb)
06f8509	3.380800	0.0	discard	experiment 1768: EMA weights eval decay=0.99 (+1.106 bpb)
06f8509	2.275000	0.0	discard	experiment 1769: x0_lambdas init 0.05 (noise, run2=2.275)
06f8509	2.275400	0.0	discard	experiment 1770: SCALAR_LR 0.45->0.50 (noise)
06f8509	2.278800	0.0	discard	experiment 1771: WARMUP_RATIO 0.0->0.05 (+0.004 bpb)
06f8509	2.281400	0.0	discard	experiment 1772: c_proj init small random (+0.007 bpb)
06f8509	2.277300	0.0	discard	experiment 1773: resid_lambdas init 0.95 (noise, avg=2.277)
f6f479b	2.275600	0.0	discard	experiment 1774: attention scale 1/head_dim (noise)
f6f479b	2.280800	0.0	discard	experiment 1775: remove NorMuon variance reduction (+0.006 bpb)
f6f479b	2.284700	0.0	discard	experiment 1776: UNEMBEDDING_LR 0.004->0.005 (+0.010 bpb)
f6f479b	2.286300	0.0	discard	experiment 1777: lm_head WD 0.0->0.01 (+0.011 bpb)
f6f479b	2.281800	0.0	discard	experiment 1778: value_embeds WD 0.0->0.01 (noise, ve disabled)
f6f479b	2.275300	0.0	discard	experiment 1779: WEIGHT_DECAY 0.01->0.005 (noise)
f6f479b	2.275500	0.0	discard	experiment 1780: embed WD 0.02->0.03 (noise)
f6f479b	2.275500	0.0	discard	experiment 1781: Muon target momentum 0.98->0.97 (noise)
f6f479b	2.283700	0.0	discard	experiment 1782: Muon ns_steps 1->2 (+0.009 bpb)
f6f479b	2.280300	0.0	discard	experiment 1783: regular WD instead of cautious (+0.005 bpb)
f6f479b	2.280700	0.0	discard	experiment 1784: RoPE base 5000->4000 (+0.006 bpb)
f6f479b	2.276800	0.0	discard	experiment 1785: RoPE base 5000->6000 (noise)
d0bec6f	2.362800	0.0	discard	experiment 1786: remove final norm (+0.088 bpb)
d0bec6f	2.284500	0.0	discard	experiment 1787: x0 betas (0.5,0.99)->(0.01,0.99) (+0.010 bpb)
d0bec6f	2.278400	0.0	discard	experiment 1788: x0 betas (0.5,0.99)->(0.7,0.99) (+0.004 bpb)
d0bec6f	2.275700	0.0	discard	experiment 1789: resid_lambdas LR factor 0.01->0.02 (noise)
d0bec6f	2.278400	0.0	discard	experiment 1790: MLP hidden 2x->1.75x (+0.004 bpb)
d0bec6f	2.972700	0.0	discard	experiment 1791: gradient noise injection (+0.698 bpb)
d0bec6f	2.282300	0.0	discard	experiment 1792: dropout before norm on embed (+0.007 bpb)
d0bec6f	2.282200	0.0	discard	experiment 1793: fixup-style alpha scaling (+0.007 bpb)
d0bec6f	2.275900	0.0	discard	experiment 1794: gate * silu(up) swapped (noise)
d0bec6f	2.275300	0.0	discard	experiment 1795: grad clip 0.06->0.05 (noise)
d0bec6f	2.276300	0.0	discard	experiment 1796: STABLE_RATIO 0.30->0.35 (noise)
d0bec6f	2.276200	0.0	discard	experiment 1797: mlp_dropout 0.20->0.25 (noise)
c6e5218	2.278100	0.0	discard	experiment 1798: heavy-ball momentum no Nesterov (+0.003 bpb)
c6e5218	2.276800	0.0	discard	experiment 1799: HEAD_DIM 64->48 (noise)
c6e5218	2.280200	0.0	discard	experiment 1800: ASPECT_RATIO 48->52 (model_dim=320->320, same)
c6e5218	2.285400	0.0	discard	experiment 1802: ASPECT_RATIO 48->42 (model_dim=256) (+0.011 bpb)
c6e5218	2.280500	0.0	discard	experiment 1803: Muon momentum start 0.90->0.95 (+0.006 bpb)
c6e5218	2.280200	0.0	discard	experiment 1804: FINAL_LR_FRAC 0.05->0.07 (+0.005 bpb)
c6e5218	2.281200	0.0	discard	experiment 1805: FINAL_LR_FRAC 0.05->0.04 (+0.006 bpb)
c6e5218	2.284000	0.0	discard	experiment 1806: constant Muon momentum 0.95 (+0.009 bpb)
c6e5218	2.276100	0.0	discard	experiment 1807: Muon momentum warmup 2->3 steps (noise)
c6e5218	0.000000	0.0	discard	experiment 1808: WD warmup over 30% (killed exit 137)
af785b3	2.283900	0.0	discard	experiment 1809: GPT-2 style c_proj init (+0.009 bpb)
af785b3	2.285400	0.0	discard	experiment 1810: QK norm before attention (+0.011 bpb)
af785b3	2.285800	0.0	discard	experiment 1811: Q-only norm with scale (+0.011 bpb)
af785b3	2.280500	0.0	discard	experiment 1812: embedding init std 1.0->0.5 (+0.006 bpb)
af785b3	2.277700	0.0	discard	experiment 1813: embedding init std 1.0->2.0 (+0.003 bpb)
af785b3	2.280100	0.0	discard	experiment 1814: increasing WD during warmdown (+0.005 bpb)
af785b3	2.280000	0.0	discard	experiment 1815: EMBEDDING_LR 1.2->1.15 (+0.005 bpb)
af785b3	2.280400	0.0	discard	experiment 1816: EMBEDDING_LR 1.2->1.25 (+0.005 bpb)
af785b3	2.281000	0.0	discard	experiment 1817: SCALAR_LR 0.45->0.40 (+0.006 bpb)
af785b3	2.277000	0.0	discard	experiment 1818: UNEMBEDDING_LR 0.004->0.0035 (noise)
af785b3	2.287000	0.0	discard	experiment 1819: grad clip 0.06->0.10 (+0.012 bpb)
af785b3	2.287000	0.0	discard	experiment 1820: Muon momentum start 0.90->0.92 (+0.012 bpb)
6d0c7dc	2.286300	0.0	discard	experiment 1821: inverted cautious WD mask (+0.011 bpb)
6d0c7dc	2.285900	0.0	discard	experiment 1822: Muon target momentum 0.98->0.99 (+0.011 bpb)
6d0c7dc	2.287000	0.0	discard	experiment 1823: x0 LR * 1.5 (+0.012 bpb)
6d0c7dc	2.291800	0.0	discard	experiment 1824: x0 LR * 0.5 (+0.017 bpb)
6d0c7dc	2.285000	0.0	discard	experiment 1825: no GC management (+0.010 bpb, fewer steps)
6d0c7dc	2.287600	0.0	discard	experiment 1826: init std 1/sqrt(n_embd) (+0.013 bpb)
6d0c7dc	2.288000	0.0	discard	experiment 1827: init std sqrt(2/(5*n_embd)) (+0.013 bpb)
6d0c7dc	0.000000	0.0	discard	experiment 1828: attention softmax dropout (hung on CPU)
6d0c7dc	2.287200	0.0	discard	experiment 1829: Adam eps 1e-10->1e-8 (+0.012 bpb)
6d0c7dc	2.285300	0.0	discard	experiment 1830: attn_dropout 0.12->0.15 (+0.010 bpb)
faef821	2.324800	0.0	discard	experiment 1831: logit L2 regularization (+0.050 bpb)
faef821	2.282900	0.0	discard	experiment 1832: MATRIX_LR 0.12->0.125 (+0.008 bpb)
faef821	2.282800	0.0	discard	experiment 1833: remove softcap (+0.008 bpb)
faef821	2.285800	0.0	discard	experiment 1834: clamp instead of tanh softcap (+0.011 bpb)
faef821	2.283400	0.0	discard	experiment 1835: WEIGHT_DECAY 0.01->0.02 (+0.009 bpb)
faef821	2.299300	0.0	discard	experiment 1836: remove embed norm (+0.024 bpb)
faef821	2.284600	0.0	discard	experiment 1837: Muon beta2 0.99->0.98 (+0.010 bpb)
faef821	2.289700	0.0	discard	experiment 1838: norm after attn c_proj (+0.015 bpb)
a24b9be	2.286300	0.0	discard	experiment 1839: MLP internal skip connection (+0.011 bpb)
a24b9be	2.284000	0.0	discard	experiment 1840: STABLE_RATIO 0.30->0.25 (+0.009 bpb)
a24b9be	2.286400	0.0	discard	experiment 1841: rms_norm eps=1e-5 (+0.012 bpb)
a24b9be	2.286100	0.0	discard	experiment 1842: LayerNorm instead of RMSNorm (+0.011 bpb)
a24b9be	2.282800	0.0	discard	experiment 1843: DEVICE_BATCH_SIZE 16->8 (+0.008 bpb)
a24b9be	2.285600	0.0	discard	experiment 1844: grad clip 0.06->0.04 (+0.011 bpb)
a24b9be	2.276600	0.0	discard	experiment 1845: logits stay bf16 (noise)
a24b9be	2.283700	0.0	discard	experiment 1846: cosine warmdown (+0.009 bpb)
a24b9be	2.281400	0.0	discard	experiment 1847: STABLE_RATIO 0.30->0.40 (+0.006 bpb)
fb6962b	2.283700	0.0	discard	experiment 1848: MLP before attention (+0.009 bpb)
fb6962b	2.283000	0.0	discard	experiment 1849: parallel attn+MLP PaLM style (+0.008 bpb)
fb6962b	2.284700	0.0	discard	experiment 1850: lambdas after block (+0.010 bpb)
fb6962b	2.283500	0.0	discard	experiment 1851: MLP hidden 2x->2.25x (+0.009 bpb)
fb6962b	2.289600	0.0	discard	experiment 1852: MLP hidden 2x->1.5x (+0.015 bpb)
fb6962b	2.289300	0.0	discard	experiment 1853: lm_head init std 0.001->0.01 (+0.014 bpb)
acb98f2	2.313200	0.0	discard	experiment 1854: TOTAL_BATCH_SIZE 64K->96K (+0.038 bpb)
acb98f2	2.283000	0.0	discard	experiment 1855: 1-step Muon momentum jump (+0.008 bpb)
acb98f2	2.282700	0.0	discard	experiment 1856: embed WD 0.02->0.015 (+0.008 bpb)
ff89e08	2.285400	0.0	discard	experiment 1857: per-layer Muon LR decay (0.7-1.0 scaling) (+0.001 bpb, also slower)
ff89e08	2.286500	0.0	discard	experiment 1858: mlp_dropout 0.20->0.16 (+0.002 bpb)
ff89e08	2.286400	0.0	discard	experiment 1859: warmdown exponent 0.7->0.65 (noise)
ff89e08	2.290400	0.0	discard	experiment 1860: embedding init std 1.0->1.5 (+0.006 bpb)
ff89e08	2.287200	0.0	discard	experiment 1861: polar norm eps 1e-6->1e-8 (+0.003 bpb)
ff89e08	2.284900	0.0	discard	experiment 1862: Muon beta2 0.99->0.995 (noise)
ff89e08	2.285800	0.0	discard	experiment 1863: truncated normal init for Q/K/V/MLP (noise)
ff89e08	2.285200	0.0	discard	experiment 1864: xavier uniform init for Q/K/V/MLP (noise)
ff89e08	2.284700	0.0	discard	experiment 1865: orthogonal init for Q/K/V/MLP (noise)
ff89e08	2.314500	0.0	discard	experiment 1866: remove x0 shortcut entirely (+0.030 bpb)
ff89e08	2.281900	-0.001	keep	experiment 1867: x0_lambdas init 0.0->0.1 (-0.001 bpb, 4 runs avg 2.2819 vs baseline 2.2830)
ff89e08	2.282400	0.0	discard	experiment 1868: x0_lambdas init 0.15 (noise vs 0.1)
ff89e08	2.293100	0.0	discard	experiment 1869: x0_lambdas init 0.2 (+0.011 bpb, too high)
e4aa9fc	2.282900	0.0	discard	experiment 1870: resid_lambdas init 1.0->0.95 (noise)
e4aa9fc	2.299300	0.0	discard	experiment 1871: c_proj init small random (std=0.001) (+0.017 bpb)
e4aa9fc	2.282500	0.0	discard	experiment 1872: EMBEDDING_LR 1.2->1.3 (noise)
e4aa9fc	2.283800	0.0	discard	experiment 1873: x0 Adam beta2 0.99->0.95 (+0.002 bpb)
e4aa9fc	2.282100	0.0	discard	experiment 1874: per-layer x0_lambdas init [0.05-0.20] (noise, avg 2.2821 vs 2.2822)
e4aa9fc	2.285700	0.0	discard	experiment 1875: x0 shortcut after block (+0.004 bpb)
e4aa9fc	2.284300	0.0	discard	experiment 1876: softcap 18->16 (+0.002 bpb)
e4aa9fc	2.282500	0.0	discard	experiment 1877: SCALAR_LR 0.45->0.60 (noise)
e4aa9fc	2.283200	0.0	discard	experiment 1878: embedding dropout 0.08->0.10 (noise)
e4aa9fc	2.283700	0.0	discard	experiment 1879: x0 weight decay 0.01 (+0.002 bpb)
e4aa9fc	2.290700	0.0	discard	experiment 1880: UNEMBEDDING_LR 0.004->0.005 (+0.009 bpb)
e4aa9fc	2.283100	0.0	discard	experiment 1881: WEIGHT_DECAY 0.01->0.015 (noise, good runs = extra step)
e4aa9fc	2.286100	0.0	discard	experiment 1882: resid LR scale 0.01->0.005 (+0.004 bpb)
238f26b	2.288300	0.0	discard	experiment 1883: sandwich norm (+0.006 bpb, also fewer steps)
238f26b	2.286200	0.0	discard	experiment 1884: MATRIX_LR 0.12->0.11 (noise, good run was 24-step)
238f26b	2.295400	0.0	discard	experiment 1885: WARMUP_RATIO 0.04 (+0.013 bpb)
238f26b	2.286400	0.0	discard	experiment 1886: Muon momentum target 0.97 (noise)
238f26b	13.165400	0.0	discard	experiment 1887: learnable final gain (diverged, wrong param group LR)
238f26b	2.302800	0.0	discard	experiment 1888: final x0 skip to output (+0.021 bpb)
238f26b	2.286400	0.0	discard	experiment 1889: Muon momentum start 0.92 (noise)
238f26b	2.287400	0.0	discard	experiment 1890: init std 1/sqrt(n_embd) (+0.005 bpb)
238f26b	2.281500	0.0	discard	experiment 1891: STABLE_RATIO 0.30->0.35 (noise, -0.0003 avg)
238f26b	2.285500	0.0	discard	experiment 1892: dropout on x0 shortcut (+0.004 bpb, fewer steps)
238f26b	2.280600	0.0	discard	experiment 1893: EMBEDDING_LR 1.2->1.1 (noise)
238f26b	2.280100	0.0	discard	experiment 1894: embed WD 0.02->0.03 (noise, good run was 24-step)
51442fa	2.286100	0.0	discard	experiment 1895: disable bf16 autocast (type error, incompatible with bf16 embeddings)
51442fa	2.286100	0.0	discard	experiment 1896: RoPE base 5000->4500 (+0.004 bpb)
51442fa	2.280700	0.0	discard	experiment 1897: x0_lambdas init 0.1->0.08 (noise)
51442fa	2.292300	0.0	discard	experiment 1898: x0_lambdas init 0.1->0.12 (+0.010 bpb at 23 steps)
51442fa	2.285800	0.0	discard	experiment 1899: SCALAR_LR 0.45->0.35 (+0.004 bpb)
51442fa	2.300000	0.0	discard	experiment 1900: enable value embeds last 2 layers (+0.018 bpb, +5M params)
