commit	val_bpb	memory_gb	status	description
5d4ad3e	2.236517	0.0	discard	experiment 947: HEAD_DIM 64->48 (+0.001 bpb, smaller heads worse)
182a868	2.235873	0.0	discard	experiment 948: DEPTH 4->3 (+0.001 bpb, not enough capacity)
7a0c96a	2.237955	0.0	discard	experiment 950: DEVICE_BATCH_SIZE 16->8 (+0.001 bpb, no speedup)
360acd7	2.236242	0.0	keep	experiment 951: MLP hidden 2x->1.5x (-0.001 bpb, fewer params)
890ade9	2.242546	0.0	discard	experiment 952: DEPTH 4->5 (+0.006 bpb, too slow at 256 dim)
b685fd4	2.240156	0.0	discard	experiment 953: DEPTH 5 + ASPECT_RATIO 38 (+0.004 bpb, too slow)
c9a39ab	2.236186	0.0	keep	experiment 954: dropout 0.2->0.15 (-0.000 bpb)
eb333f9	2.236308	0.0	discard	experiment 955: mlp_dropout 0.25->0.20 (+0.000 bpb)
5fb77ad	2.236394	0.0	discard	experiment 956: attn_dropout 0.08->0.04 (+0.000 bpb)
fccc19e	2.237073	0.0	discard	experiment 957: STABLE_RATIO 0.35->0.40 (+0.001 bpb)
44e49c9	2.251149	0.0	discard	experiment 958: TOTAL_BATCH_SIZE 2^18->2^17 (+0.015 bpb, too noisy)
51cd6ae	2.236763	0.0	discard	experiment 959: embedding dropout 0.08->0.0 (+0.001 bpb)
0873534	2.240060	0.0	discard	experiment 960: linear->cosine LR decay (+0.004 bpb)
8b51590	2.236605	0.0	discard	experiment 961: FINAL_LR_FRAC 0.03->0.01 (+0.000 bpb)
8345c74	2.236455	0.0	discard	experiment 962: RoPE base 5000->4000 (+0.000 bpb)
1eaa9f8	2.238074	0.0	discard	experiment 963: MLP hidden 1.5x->1.667x (+0.002 bpb)
fcd3c37	2.236876	0.0	discard	experiment 964: MLP hidden 1.5x->1.333x (+0.001 bpb)
500acd4	2.237058	0.0	discard	experiment 965: attn_dropout 0.08->0.04 + embedding dropout 0.08->0.04 (+0.001 bpb)
0597d40	2.235718	0.0	keep	experiment 966: remove QK-norm (-0.000 bpb)
cde05f3	2.238646	0.0	discard	experiment 967: x0_lambda init 0.05->0.10 (+0.003 bpb)
8f047a0	2.235661	0.0	keep	experiment 968: x0_lambda init 0.05->0.0 (remove input bypass, -0.000 bpb)
cead69b	2.236197	0.0	discard	experiment 969: SCALAR_LR 0.50->0.25 (+0.001 bpb)
89b12d4	2.281372	0.0	discard	experiment 970: ADAM_BETAS (0.01,0.99)->(0.9,0.999) (+0.046 bpb)
8f9e674	2.236206	0.0	discard	experiment 971: EMBEDDING_LR 0.7->1.0 (+0.001 bpb)
ebc2bf1	2.234604	0.0	keep	experiment 972: grad clip 0.4->0.3 (-0.001 bpb)
0ad062f	2.234886	0.0	discard	experiment 973: grad clip 0.3->0.2 (+0.000 bpb)
99f3b8a	2.234248	0.0	keep	experiment 974: STABLE_RATIO 0.35->0.25 (-0.000 bpb)
f582420	2.235114	0.0	discard	experiment 975: STABLE_RATIO 0.25->0.15 (+0.001 bpb)
41916b4	2.234331	0.0	discard	experiment 976: MATRIX_LR 0.10->0.08 (+0.000 bpb)
c4d15d1	2.258438	0.0	discard	experiment 977: UNEMBEDDING_LR 0.006->0.01 (+0.024 bpb)
c483a72	2.240741	0.0	discard	experiment 978: embedding dropout 0.08->0.0 (+0.006 bpb)
1b13cc5	2.234439	0.0	discard	experiment 979: WEIGHT_DECAY 0.01->0.0 (+0.000 bpb)
2937e79	2.234650	0.0	discard	experiment 980: init std (2/3n)^0.5->(2/5n)^0.5 (+0.000 bpb)
2afb6a0	2.235407	0.0	discard	experiment 981: Muon momentum ramp 8->4 steps (+0.001 bpb)
09f9cb4	2.349920	0.0	discard	experiment 982: label smoothing 0.0->0.05 (+0.116 bpb)
e713d88	2.235853	0.0	discard	experiment 983: mlp_dropout 0.25->0.20 (+0.002 bpb)
e020f6e	2.236136	0.0	discard	experiment 984: mlp_dropout 0.25->0.30 (+0.002 bpb)
870b2af	2.234038	0.0	keep	experiment 985: FINAL_LR_FRAC 0.03->0.05 (-0.000 bpb)
92ab0cd	2.234816	0.0	discard	experiment 986: FINAL_LR_FRAC 0.05->0.08 (+0.001 bpb)
7f61b41	2.234379	0.0	discard	experiment 987: remove post-embedding norm (+0.000 bpb)
026fc0d	2.236147	0.0	discard	experiment 988: DEVICE_BATCH_SIZE 16->32 (+0.002 bpb)
553eaca	2.235889	0.0	discard	experiment 989: linear->cosine LR decay (+0.002 bpb)
5cfd12b	2.247236	0.0	discard	experiment 990: ASPECT_RATIO 48->56 (+0.013 bpb)
45112b7	2.233115	0.0	keep	experiment 991: MATRIX_LR 0.10->0.12 (-0.001 bpb)
3df3162	2.233574	0.0	discard	experiment 992: MATRIX_LR 0.12->0.15 (+0.000 bpb)
f7c909e	2.234554	0.0	discard	experiment 993: EMBEDDING_LR 0.7->0.5 (+0.001 bpb)
cbbb8ab	2.234469	0.0	discard	experiment 994: Muon ns_steps 1->2 (+0.001 bpb)
3140f39	2.235561	0.0	discard	experiment 995: WEIGHT_DECAY 0.01->0.02 (+0.002 bpb)
5fd03eb	2.234147	0.0	discard	experiment 996: SCALAR_LR 0.50->1.0 (+0.001 bpb)
77f63b0	2.239049	0.0	discard	experiment 997: HEAD_DIM 64->32 (+0.006 bpb)
99269f2	2.234055	0.0	discard	experiment 998: STABLE_RATIO 0.25->0.20 (+0.001 bpb)
78f1d03	2.245446	0.0	discard	experiment 999: WARMUP_RATIO 0.0->0.05 (+0.012 bpb)
3f799a4	2.237152	0.0	discard	experiment 1000: embedding dropout 0.08->0.12 (+0.004 bpb)
cf70566	2.239184	0.0	discard	experiment 1001: lm_head init std 0.001->0.01 (+0.006 bpb)
7237e70	2.235351	0.0	discard	experiment 1002: RoPE base 5000->10000 (+0.002 bpb)
1e76dbe	2.235251	0.0	discard	experiment 1003: dropout 0.15->0.10 (+0.002 bpb)
5009698	2.233858	0.0	discard	experiment 1004: Muon beta2 0.99->0.95 (+0.001 bpb)
4a9a4e4	2.234507	0.0	discard	experiment 1005: Muon momentum 0.95->0.90 (+0.001 bpb)
5ca881e	2.233760	0.0	discard	experiment 1006: ADAM_BETAS beta1 0.01->0.02 (+0.001 bpb)
0338926	2.234008	0.0	discard	experiment 1007: embedding init std 1.0->0.5 (+0.001 bpb)
94644e3	2.243597	0.0	discard	experiment 1008: remove resid_lambdas from forward (+0.010 bpb)
056ec9b	2.234243	0.0	discard	experiment 1009: RoPE base 5000->2500 (+0.001 bpb)
0effe8d	2.234188	0.0	discard	experiment 1010: MATRIX_LR 0.12->0.11 (+0.001 bpb)
ee8a020	2.258320	0.0	discard	experiment 1011: UNEMBEDDING_LR 0.006->0.01 (+0.025 bpb)
86832c4	2.233884	0.0	discard	experiment 1012: grad clip 0.3->0.25 (+0.001 bpb)
2aa7705	2.236766	0.0	discard	experiment 1013: MLP hidden 1.5x->2x (+0.004 bpb)
b536319	2.255057	0.0	discard	experiment 1014: UNEMBEDDING_LR 0.006->0.004 (+0.022 bpb)
e1855d2	2.235415	0.0	discard	experiment 1015: remove cautious WD mask (+0.002 bpb)
8738f76	2.235304	0.0	discard	experiment 1016: EMBEDDING_LR 0.7->1.0 (+0.002 bpb)
7768c13	2.234582	0.0	discard	experiment 1017: MATRIX_LR 0.12->0.13 (+0.001 bpb)
d792407	2.235475	0.0	discard	experiment 1018: SiLU->GELU activation (+0.002 bpb)
43c6feb	2.235567	0.0	discard	experiment 1019: Muon momentum warmup 8->4 steps (+0.002 bpb)
97fb0e2	2.235478	0.0	discard	experiment 1020: ADAM_BETAS beta2 0.99->0.95 (+0.002 bpb)
21a5d76	2.239695	0.0	discard	experiment 1021: DEPTH 5 ASPECT_RATIO 38 (+0.007 bpb)
367ad14	2.381443	0.0	discard	experiment 1022: linear weight decay schedule WD*1->0.5 (+0.006 bpb)
6a8c3b2	2.238983	0.0	discard	experiment 1036: c_proj init small random (+0.002 bpb)
c2e49e6	2.233632	0.0	keep	experiment 1037: DEPTH 4->3 (-0.003 bpb, 12 steps)
09fd0f3	2.233536	0.0	keep	experiment 1055: grad clip 0.3->0.2 (-0.000 bpb)
2f9a1e4	2.233234	0.0	keep	experiment 1056: grad clip 0.2->0.15 (-0.000 bpb)
f1f72d1	2.233086	0.0	keep	experiment 1057: grad clip 0.15->0.10 (-0.000 bpb)
a43440b	2.233066	0.0	keep	experiment 1058: grad clip 0.10->0.05 (-0.000 bpb)
f349cb7	2.233040	0.0	keep	experiment 1066: attn_dropout 0.08->0.12 (-0.000 bpb)
f023170	2.232905	0.0	keep	experiment 1070: embedding dropout 0.08->0.10 (-0.000 bpb)
bea499e	2.238514	0.0	keep	experiment 1157: RoPE base 5000->10000 (-0.004 bpb)
b0511b2	2.385844	0.0	discard	experiment 1158: FINAL_LR_FRAC 0.05->0.02 (+0.032 bpb)
c1d8270	2.345932	0.0	keep	experiment 1159: embedding dropout 0.10->0.12 (-0.008 bpb)
82f1420	2.372006	0.0	discard	experiment 1160: embedding dropout 0.12->0.15 (+0.026 bpb)
bb5ae3e	2.356809	0.0	discard	experiment 1161: mlp_dropout 0.25->0.20 (+0.011 bpb)
66429b3	2.356681	0.0	discard	experiment 1162: mlp_dropout 0.25->0.30 (+0.011 bpb)
f3dcfaf	2.359681	0.0	discard	experiment 1163: WEIGHT_DECAY 0.01->0.02 (+0.014 bpb)
b609207	2.273314	0.0	keep	experiment 1164: TOTAL_BATCH_SIZE 2^18->2^17 (-0.073 bpb)
f786ca5	2.266964	0.0	keep	experiment 1165: TOTAL_BATCH_SIZE 2^17->2^16, 18 steps (-0.009 bpb)
fa14322	2.371241	0.0	baseline	baseline (new session, fresh tokenizer): DEPTH=3, ASPECT_RATIO=48, HEAD_DIM=64, MATRIX_LR=0.12, dropout=0.15/0.12/0.25, grad_clip=0.05, ns_steps=1
a0c8eff	2.385471	0.0	discard	experiment 1200: TOTAL_BATCH_SIZE 2^16->2^15 (+0.014 bpb, 75 steps)
a1b4136	2.351479	0.0	keep	experiment 1201: DEPTH 3->4 (-0.020 bpb, 36 steps)
5c3d328	2.316626	0.0	keep	experiment 1202: DEPTH 4->5 (-0.035 bpb, 25 steps)
ccd1e63	2.304074	0.0	keep	experiment 1203: DEPTH 5->6 (-0.013 bpb, 18 steps)
fa084a5	2.307645	0.0	discard	experiment 1204: DEPTH 6->7 (+0.004 bpb, 14 steps too few)
a0d83c5	2.316606	0.0	discard	experiment 1205: ASPECT_RATIO 48->64 (+0.013 bpb, 15 steps too few)
6cf49b9	2.335732	0.0	discard	experiment 1206: ASPECT_RATIO 48->32 (+0.032 bpb, too narrow)
7b6422e	2.308821	0.0	discard	experiment 1207: MATRIX_LR 0.12->0.15 (+0.005 bpb)
982491e	2.313971	0.0	discard	experiment 1208: reduce dropout 0.15/0.12/0.25->0.10/0.08/0.15 (+0.010 bpb)
7e240b9	2.316390	0.0	discard	experiment 1209: increase dropout 0.20/0.15/0.30 (+0.012 bpb)
365a406	2.322105	0.0	discard	experiment 1210: STABLE_RATIO 0.25->0.40 (+0.018 bpb)
6a6cbfe	2.315599	0.0	discard	experiment 1211: STABLE_RATIO 0.25->0.10 (+0.012 bpb)
1c16481	2.326220	0.0	discard	experiment 1212: HEAD_DIM 64->48 (+0.022 bpb)
a4d7d4c	2.314627	0.0	discard	experiment 1213: relax grad clip 0.05->1.0 (+0.011 bpb)
a86adc9	2.322257	0.0	discard	experiment 1214: MLP hidden 4*n_embd//3 (+0.018 bpb)
f491c13	2.316921	0.0	discard	experiment 1215: EMBEDDING_LR 0.7->1.0 (+0.013 bpb)
aeffd27	2.317209	0.0	discard	experiment 1216: WEIGHT_DECAY 0.01->0.03 (+0.013 bpb)
2d6c061	2.316059	0.0	discard	experiment 1217: RoPE base 10000->5000 (+0.012 bpb)
6fb0400	2.307889	0.0	discard	experiment 1218: add QK-norm (+0.004 bpb)
4092b47	2.335473	0.0	discard	experiment 1219: DEVICE_BATCH_SIZE 16->8 (+0.031 bpb)
f6391a4	2.320692	0.0	discard	experiment 1220: remove embedding dropout (+0.017 bpb)
54dd027	2.321660	0.0	discard	experiment 1221: FINAL_LR_FRAC 0.05->0.10 (+0.018 bpb)
3323c9b	2.376354	0.0	discard	experiment 1222: UNEMBEDDING_LR 0.006->0.010 (+0.072 bpb)
c49fa8b	2.526698	0.0	discard	experiment 1223: label smoothing 0.1 (+0.223 bpb)
c49fa8b	2.320996	0.0	discard	experiment 1224: cosine LR decay (+0.017 bpb)
c49fa8b	2.322502	0.0	discard	experiment 1225: ADAM_BETAS beta1 0.01->0.05 (+0.018 bpb)
c49fa8b	2.322235	0.0	discard	experiment 1226: MATRIX_LR 0.12->0.08 (+0.018 bpb)
c49fa8b	2.310414	0.0	discard	experiment 1227: MLP hidden 2*n_embd (+0.006 bpb)
c49fa8b	2.308067	0.0	discard	experiment 1228: WARMUP_RATIO 0.0->0.05 (+0.004 bpb)
c49fa8b	2.314054	0.0	discard	experiment 1229: SCALAR_LR 0.45->0.2 (+0.010 bpb)
c49fa8b	2.322764	0.0	discard	experiment 1230: EMBEDDING_LR 0.7->0.4 (+0.019 bpb)
c49fa8b	2.323684	0.0	discard	experiment 1231: seed 42->137 (+0.020 bpb)
c49fa8b	2.321314	0.0	discard	experiment 1232: Muon ns_steps 1->2 (+0.017 bpb)
c49fa8b	2.309690	0.0	discard	experiment 1233: remove x0 shortcut (+0.006 bpb)
c49fa8b	2.327088	0.0	discard	experiment 1234: remove resid_lambdas (+0.023 bpb)
c49fa8b	2.321517	0.0	discard	experiment 1235: FINAL_LR_FRAC 0.05->0.01 (+0.017 bpb)
c49fa8b	2.323244	0.0	discard	experiment 1236: remove cautious WD mask from Muon (+0.019 bpb)
c49fa8b	2.301632	0.0	keep	experiment 1237: logit softcap=30 (-0.002 bpb, avg of 3 runs: 2.302)
71f6af4	2.298799	0.0	keep	experiment 1238: logit softcap 30->20 (-0.003 bpb)
e791b4d	2.297576	0.0	discard	experiment 1239: softcap 20->15 (avg 2.299 same as baseline)
e791b4d	2.299337	0.0	discard	experiment 1240: softcap 20->10 (no improvement)
e791b4d	2.301506	0.0	discard	experiment 1241: c_proj small nonzero init (+0.003 bpb)
e791b4d	2.298171	0.0	keep	experiment 1242: UNEMBEDDING_LR 0.006->0.003 (-0.001 bpb)
4713f5c	2.523313	0.0	discard	experiment 1243: UNEMBEDDING_LR 0.003->0.001 (+0.225 bpb)
4713f5c	2.292573	0.0	keep	experiment 1244: UNEMBEDDING_LR 0.003->0.004 (-0.005 bpb)
41a9149	2.293860	0.0	discard	experiment 1245: UNEMBEDDING_LR 0.004->0.005 (+0.001 bpb)
41a9149	2.293718	0.0	discard	experiment 1246: EMBEDDING_LR 0.7->0.5 (no improvement)
41a9149	2.292651	0.0	discard	experiment 1247: WEIGHT_DECAY 0.01->0.0 (no improvement)
41a9149	2.292903	0.0	discard	experiment 1248: MATRIX_LR 0.12->0.10 (no improvement)
41a9149	2.302448	0.0	discard	experiment 1249: sandwich norm (+0.009 bpb)
41a9149	2.287479	0.0	keep	experiment 1250: embedding dropout 0.12->0.08 (-0.005 bpb)
fde3590	2.288148	0.0	discard	experiment 1251: embedding dropout 0.08->0.05 (no improvement)
fde3590	2.288284	0.0	discard	experiment 1252: dropout 0.15->0.10, attn_dropout 0.12->0.08 (no improvement)
fde3590	2.294485	0.0	keep	experiment 1253: mlp_dropout 0.25->0.20 (-0.007 bpb)
0d60a7b	2.297316	0.0	discard	experiment 1254: mlp_dropout 0.20->0.15 (+0.002 bpb)
0d60a7b	2.297540	0.0	discard	experiment 1255: attn_dropout 0.12->0.08 (+0.003 bpb)
0d60a7b	2.295460	0.0	discard	experiment 1256: STABLE_RATIO 0.25->0.15 (no improvement)
0d60a7b	2.284892	0.0	keep	experiment 1257: STABLE_RATIO 0.25->0.35 (-0.010 bpb)
8a9d9fa	2.286644	0.0	discard	experiment 1258: STABLE_RATIO 0.35->0.45 (+0.002 bpb)
8a9d9fa	2.287385	0.0	discard	experiment 1259: STABLE_RATIO 0.35->0.30 (+0.002 bpb)
8a9d9fa	2.286989	0.0	discard	experiment 1260: MATRIX_LR 0.12->0.14 (+0.002 bpb)
8a9d9fa	2.289022	0.0	discard	experiment 1261: EMBEDDING_LR 0.7->0.9 (+0.004 bpb)
8a9d9fa	2.290037	0.0	discard	experiment 1262: Muon beta2 0.99->0.95 (+0.005 bpb)
8a9d9fa	2.287846	0.0	discard	experiment 1263: grad_clip 0.05->0.10 (+0.003 bpb)
8a9d9fa	2.328592	0.0	discard	experiment 1264: lm_head init std 0.001->0.01 (+0.043 bpb)
8a9d9fa	2.283294	0.0	discard	experiment 1265: RoPE base 10000->50000 (inconsistent, avg 2.287 vs 2.285)
8a9d9fa	2.290638	0.0	discard	experiment 1266: dropout 0.15->0.10 (+0.006 bpb)
cd311cd	2.286894	0.0	discard	experiment 1267: weight tying wte=lm_head (+0.002 bpb)
cd311cd	2.288147	0.0	discard	experiment 1268: ADAM beta2 0.99->0.95 (+0.003 bpb)
cd311cd	2.297990	0.0	discard	experiment 1269: x0_lambdas init 0.0->0.1 (+0.013 bpb)
cd311cd	2.287485	0.0	discard	experiment 1270: SCALAR_LR 0.45->0.6 (+0.002 bpb)
cd311cd	2.284162	0.0	keep	experiment 1271: Muon momentum warmup 8->4 steps (-0.001 bpb)
7fb3071	2.285614	0.0	discard	experiment 1272: Muon momentum warmup 4->2 steps (+0.002 bpb)
7fb3071	2.285228	0.0	discard	experiment 1273: Muon final momentum 0.98->0.99 (+0.001 bpb)
7fb3071	2.306457	0.0	discard	experiment 1274: TOTAL_BATCH_SIZE 2^16->2^17 (+0.022 bpb, only 11 steps)
7fb3071	999.0	0.0	discard	experiment 1275: attention logit softcap (OOM/too slow, no steps completed)
7fb3071	2.295689	0.0	discard	experiment 1276: FINAL_LR_FRAC 0.05->0.02 (+0.012 bpb)
7fb3071	2.293898	0.0	discard	experiment 1277: remove gc.freeze() (+0.010 bpb)
7fb3071	2.296518	0.0	discard	experiment 1278: wte init std 1.0->0.5 (+0.012 bpb)
7fb3071	2.304879	0.0	discard	experiment 1279: ASPECT_RATIO 48->56 (+0.021 bpb, 13 steps)
eeae1f4	2.301592	0.0	discard	experiment 1280: GELU MLP instead of SwiGLU (+0.018 bpb)
eeae1f4	999.0	0.0	discard	experiment 1281: multi-query attention n_kv_head=1 (OOM exit 137)
eeae1f4	2.299755	0.0	discard	experiment 1282: init std 1/sqrt(n_embd) (+0.016 bpb)
eeae1f4	2.293232	0.0	discard	experiment 1283: UNEMBEDDING_LR 0.004->0.0045 (+0.009 bpb)
eeae1f4	2.295512	0.0	discard	experiment 1284: softcap 20->25 (+0.011 bpb)
eeae1f4	2.303448	0.0	discard	experiment 1285: dmodel_lr_scale exponent -0.5->-0.25 (+0.019 bpb)
eeae1f4	2.283747	0.0	discard	experiment 1286: stochastic depth p=0.1 (no improvement)
eeae1f4	2.286888	0.0	discard	experiment 1287: MATRIX_LR 0.12->0.11 (+0.003 bpb)
eeae1f4	2.286858	0.0	discard	experiment 1288: MATRIX_LR 0.12->0.13 (+0.003 bpb)
99d48f4	2.300495	0.0	discard	experiment 1289: resid_lambdas LR *0.01->*0.005 (+0.016 bpb)
99d48f4	2.287995	0.0	discard	experiment 1290: EMBEDDING_LR 0.7->0.6 (+0.004 bpb)
99d48f4	2.284428	0.0	discard	experiment 1291: early stop step>5 instead of step>10 (no improvement)
99d48f4	2.305576	0.0	discard	experiment 1292: remove post-embedding norm (+0.022 bpb)
99d48f4	2.369005	0.0	discard	experiment 1293: remove pre-lm_head norm (+0.085 bpb)
99d48f4	2.286206	0.0	discard	experiment 1294: MLP hidden 5*n_embd//3 (+0.002 bpb)
99d48f4	2.291310	0.0	discard	experiment 1295: MLP hidden 4*n_embd//3 (+0.007 bpb)
09ff958	2.289865	0.0	discard	experiment 1296: softcap in bf16 before float cast (+0.006 bpb)
09ff958	2.286118	0.0	discard	experiment 1297: WEIGHT_DECAY 0.01->0.005 (+0.002 bpb)
09ff958	2.283084	0.0	discard	experiment 1298: WEIGHT_DECAY 0.01->0.02 (avg 2.284 same as baseline)
09ff958	999.0	0.0	discard	experiment 1299: DEVICE_BATCH_SIZE 16->32 (OOM exit 137)
09ff958	2.294612	0.0	discard	experiment 1300: remove Muon LR shape scaling (+0.011 bpb)
09ff958	2.297297	0.0	discard	experiment 1301: WINDOW_PATTERN SL (+0.013 bpb)
09ff958	2.293244	0.0	discard	experiment 1302: x0_lambdas betas (0.5,0.99)->(0.01,0.99) (+0.009 bpb)
0dce4a6	2.296263	0.0	discard	experiment 1303: ReGLU squared gate (+0.012 bpb)
0dce4a6	2.293034	0.0	discard	experiment 1304: Muon initial momentum 0.85->0.90 (+0.009 bpb)
0dce4a6	2.354012	0.0	discard	experiment 1305: torch.set_num_threads(4) fewer steps (+0.056 bpb)
5deff38	2.339093	0.0	discard	experiment 1306: grad clip 0.05->0.03 (+0.041 bpb)
5deff38	2.304834	0.0	discard	experiment 1307: grad clip 0.05->0.1 (+0.006 bpb)
5deff38	2.307019	0.0	discard	experiment 1308: cosine decay schedule (+0.009 bpb)
5deff38	2.309449	0.0	discard	experiment 1309: attn dropout 0.12->0.08 (+0.011 bpb)
5deff38	2.301270	0.0	discard	experiment 1310: attn dropout 0.12->0.15 (+0.003 bpb)
5deff38	2.317063	0.0	discard	experiment 1311: general dropout 0.15->0.10 (+0.019 bpb)
5deff38	2.337972	0.0	discard	experiment 1312: general dropout 0.15->0.20 (+0.040 bpb)
5deff38	2.287997	0.0	discard	experiment 1313: FINAL_LR_FRAC 0.05->0.01 (no improvement at 22 steps)
5deff38	2.290078	0.0	discard	experiment 1314: ADAM_BETAS beta2 0.99->0.95 (+0.003 bpb)
5deff38	2.294458	0.0	discard	experiment 1315: softcap 20->18 (+0.007 bpb)
5deff38	2.296539	0.0	discard	experiment 1316: RoPE base 10000->5000 (+0.010 bpb)
5deff38	2.405178	0.0	discard	experiment 1317: label smoothing 0.05 (+0.118 bpb)
5deff38	2.294805	0.0	discard	experiment 1318: polar express norm 1.02->1.005 (+0.008 bpb)
af132e2	2.292073	0.0	discard	experiment 1319: Muon ns_steps 1->2 (+0.005 bpb)
af132e2	2.291072	0.0	discard	experiment 1320: EMBEDDING_LR 0.7->0.5 (+0.004 bpb)
af132e2	2.288600	0.0	discard	experiment 1321: GELU gate instead of SiLU (+0.002 bpb)
af132e2	2.294008	0.0	discard	experiment 1322: MATRIX_LR 0.12->0.14 (+0.007 bpb)
af132e2	2.290633	0.0	discard	experiment 1323: MATRIX_LR 0.12->0.10 (+0.004 bpb)
af132e2	2.307576	0.0	discard	experiment 1324: UNEMBEDDING_LR 0.004->0.005 (+0.021 bpb)
af132e2	2.293213	0.0	discard	experiment 1325: STABLE_RATIO 0.35->0.40 (+0.006 bpb)
27bd9fd	2.291013	0.0	discard	experiment 1326: embedding init std 1.0->0.5 (+0.004 bpb)
27bd9fd	2.290597	0.0	discard	experiment 1327: SCALAR_LR 0.45->0.60 (+0.004 bpb)
27bd9fd	2.299963	0.0	discard	experiment 1328: disable x0 shortcut LR=0 (+0.013 bpb)
27bd9fd	2.296185	0.0	discard	experiment 1329: regular weight decay no cautious mask (+0.009 bpb)
27bd9fd	2.286977	0.0	discard	experiment 1330: WARMUP_RATIO 0.0->0.05 (no improvement)
27bd9fd	2.292522	0.0	discard	experiment 1331: Muon beta2 0.99->0.95 (+0.006 bpb)
27bd9fd	2.284225	0.0	keep	experiment 1332: remove dmodel LR scaling (avg 2.284 vs 2.292 baseline, -0.008 bpb)
a4bd0ce	2.281659	0.0	keep	experiment 1333: EMBEDDING_LR 0.7->1.0 (avg 2.282 vs 2.284, -0.002 bpb)
0d58d1d	2.286362	0.0	discard	experiment 1334: UNEMBEDDING_LR 0.004->0.006 (+0.004 bpb)
0d58d1d	2.285604	0.0	discard	experiment 1335: EMBEDDING_LR 1.0->1.2 (+0.004 bpb)
0d58d1d	2.285749	0.0	discard	experiment 1336: SCALAR_LR 0.45->0.30 (+0.004 bpb)
0d58d1d	2.285641	0.0	discard	experiment 1337: embedding dropout 0.08->0.05 (+0.004 bpb)
0d58d1d	2.287008	0.0	discard	experiment 1338: mlp_dropout 0.20->0.15 (+0.005 bpb)
0d58d1d	2.285620	0.0	discard	experiment 1339: ADAM_BETAS beta1 0.01->0.005 (+0.004 bpb)
0d58d1d	2.285561	0.0	discard	experiment 1340: Muon momentum 0.98->0.95 (+0.004 bpb)
84aea5f	2.286778	0.0	discard	experiment 1341: WEIGHT_DECAY 0.01->0.015 (+0.005 bpb)
84aea5f	2.296862	0.0	discard	experiment 1342: DEPTH 7 ASPECT_RATIO 40 (+0.015 bpb)
84aea5f	2.283633	0.0	discard	experiment 1343: DEPTH 5 ASPECT_RATIO 60 (avg 2.284, same as baseline)
84aea5f	2.299933	0.0	discard	experiment 1344: UNEMBEDDING_LR 0.004->0.003 (+0.018 bpb)
84aea5f	2.288749	0.0	discard	experiment 1345: resid_lambdas init 1.0->1.1 (+0.007 bpb)
84aea5f	2.328120	0.0	discard	experiment 1346: TOTAL_BATCH_SIZE 2^16->2^17 (+0.046 bpb)
84aea5f	2.289134	0.0	discard	experiment 1347: TOTAL_BATCH_SIZE 2^16->2^15 (+0.007 bpb)
106f218	2.999000	0.0	discard	experiment 1348: lm_head bias=True (FAIL, loss explosion)
106f218	2.289000	0.0	discard	experiment 1349: STABLE_RATIO 0.35->0.30 (+0.007 bpb)
106f218	2.285535	0.0	discard	experiment 1350: learnable softcap (reverted, incomplete setup)
106f218	2.287747	0.0	discard	experiment 1351: gradient clipping 0.05->0.10 (+0.002 bpb)
106f218	2.286026	0.0	discard	experiment 1352: SCALAR_LR 0.45->0.35 (+0.001 bpb)
106f218	2.283761	0.0	keep	experiment 1353: Muon momentum warmup 4->2 steps (-0.002 bpb)
4d882fc	2.285586	0.0	discard	experiment 1354: WEIGHT_DECAY 0.01->0.02 (noise)
4d882fc	2.281155	0.0	keep	experiment 1355: FINAL_LR_FRAC 0.05->0.02 (-0.004 bpb)
9334c7c	2.281547	0.0	discard	experiment 1356: FINAL_LR_FRAC 0.02->0.01 (noise)
9334c7c	2.282053	0.0	discard	experiment 1357: STABLE_RATIO 0.35->0.30 (+0.001 bpb)
9334c7c	2.281615	0.0	discard	experiment 1358: Muon momentum target 0.98->0.96 (noise)
9334c7c	2.281379	0.0	discard	experiment 1359: EMBEDDING_LR 1.0->1.2 (noise)
9334c7c	2.279408	0.0	keep	experiment 1360: RoPE base 10000->5000 (-0.002 bpb)
0670ad3	2.279817	0.0	discard	experiment 1361: RoPE base 5000->3000 (noise)
0670ad3	2.280068	0.0	discard	experiment 1362: MATRIX_LR 0.12->0.14 (noise)
0670ad3	2.284229	0.0	discard	experiment 1363: x0 betas (0.5,0.99)->(0.3,0.99) (+0.004 bpb)
0670ad3	2.282751	0.0	discard	experiment 1364: UNEMBEDDING_LR 0.004->0.005 (+0.003 bpb)
0670ad3	2.279440	0.0	discard	experiment 1365: Muon momentum start 0.85->0.90 (noise)
